{
  "schemaVersion": "2.0.0", "collectedAtUtc": "2026-08-16T12:00:00Z", "collectorVersion": "2.0.0", "mode": "dev",
  "platform": { "os": "Microsoft Windows", "architecture": "X64", "machineNameHash": "aaaaaaaaaaaaaaaaaaaaaaaaaaaaaaaaaaaaaaaaaaaaaaaaaaaaaaaaaaaaaaaa" },
  "tools": {
    "powershell": { "status": "disponivel", "exitCode": 0, "output": "Desktop 5.1" }, "git": { "status": "disponivel", "exitCode": 0, "output": "2.46" },
    "java": { "status": "disponivel", "exitCode": 0, "output": "21" }, "maven": { "status": "disponivel", "exitCode": 0, "output": "3.9" },
    "node": { "status": "disponivel", "exitCode": 0, "output": "22" }, "npm": { "status": "disponivel", "exitCode": 0, "output": "10" },
    "docker": { "status": "disponivel", "exitCode": 0, "output": "27" }, "compose": { "status": "disponivel", "exitCode": 0, "output": "2.29" }
  },
  "repository": { "revision": { "status": "disponivel", "exitCode": 0, "output": "0123456789abcdef0123456789abcdef01234567" }, "dirty": false },
  "compose": { "status": "disponivel", "effectiveConfigSha256": "bbbbbbbbbbbbbbbbbbbbbbbbbbbbbbbbbbbbbbbbbbbbbbbbbbbbbbbbbbbbbbbb" },
  "services": [
    { "name": "postgres", "containerId": "pg1", "status": "running", "health": "healthy", "exitCode": 0 },
    { "name": "postgres-bootstrap", "containerId": "boot1", "status": "exited", "health": "nao_configurado", "exitCode": 0 },
    { "name": "backend", "containerId": "be1", "status": "running", "health": "healthy", "exitCode": 0 },
    { "name": "automation-worker", "containerId": "wo1", "status": "running", "health": "healthy", "exitCode": 0 },
    { "name": "frontend", "containerId": "fe1", "status": "running", "health": "healthy", "exitCode": 0 }
  ],
  "devIsolation": { "keycloakAbsent": true, "bootstrapNotRunning": true },
  "endpoints": { "backendLiveness": { "status": "disponivel", "statusCode": 200 }, "backendReadiness": { "status": "disponivel", "statusCode": 200 }, "workerHealth": { "status": "disponivel", "statusCode": 200 }, "frontendHealth": { "status": "disponivel", "statusCode": 200 }, "frontendProxyInfo": { "status": "disponivel", "statusCode": 200 } },
  "database": { "flywayLatest": { "status": "disponivel", "exitCode": 0, "output": "12|t" }, "keycloakLiquibase": null },
  "comparison": { "postgresContainerReused": true }, "outcome": "completo"
}
